[
  {
    "id": "angry-salmon-anchor-point",
    "name": "The Angry Salmon",
    "city": "Anchor Point",
    "address": "Anchor Point, AK",
    "lat": 59.7767,
    "lng": -151.8336,
    "website": "",
    "facebookUrl": "",
    "capacity": 100,
    "indoor": true,
    "aliases": [
      "angry salmon",
      "the angry salmon lodge",
      "the angry salmon"
    ],
    "facebookEventsUrl": "",
    "phone": "",
    "email": "",
    "contactPerson": "",
    "type": "Live Music Venue",
    "amenities": [],
    "scrapeNotes": "Search Facebook or web for 'The Angry Salmon' in Anchor Point."
  },
  {
    "id": "49th-state-brewery",
    "name": "49th State Brewing",
    "city": "Anchorage",
    "address": "717 W 3rd Ave, Anchorage, AK 99501",
    "lat": 61.2192,
    "lng": -149.8942,
    "website": "https://www.49statebrewing.com/",
    "facebookUrl": "https://www.facebook.com/49thStateBrewingCoAnchorage",
    "capacity": 450,
    "indoor": true,
    "aliases": [
      "49th state brewery",
      "49th state brewing company",
      "49th state brewing co",
      "49thstate brewing",
      "49th state",
      "49th state brewing"
    ],
    "facebookEventsUrl": "https://www.facebook.com/49thStateBrewingDenaliPark/events",
    "phone": "(907) 683-2739",
    "email": "info@49statebrewing.com",
    "contactPerson": "",
    "type": "Live Music Venue",
    "amenities": [],
    "scrapeNotes": "Check https://www.facebook.com/49thStateBrewingDenaliPark/events for upcoming shows."
  },
  {
    "id": "907-alehouse",
    "name": "907 Alehouse",
    "city": "Anchorage",
    "address": "8401 Old Seward Hwy, Anchorage, AK 99515",
    "lat": 61.144,
    "lng": -149.878,
    "website": "https://www.907alehouse.com/",
    "facebookUrl": "https://www.facebook.com/907Alehouse",
    "capacity": 250,
    "indoor": true,
    "aliases": [
      "907 alehouse & grill",
      "7-alehouse",
      "907 ale house",
      "907 alehouse"
    ],
    "facebookEventsUrl": "https://www.facebook.com/907alehouse/events",
    "phone": "(907) 868-4000",
    "email": "robert@907ale.com",
    "contactPerson": "",
    "type": "Live Music Venue",
    "amenities": [],
    "scrapeNotes": "Check https://www.facebook.com/907alehouse/events for upcoming shows."
  },
  {
    "id": "ak-concerts",
    "name": "AK\u00a0Concerts",
    "city": "Anchorage",
    "address": "Anchorage",
    "lat": 61.2198,
    "lng": -149.9037,
    "website": "https://www.akconcerts.com",
    "facebookUrl": "",
    "capacity": null,
    "indoor": true,
    "aliases": [
      "ak\u00a0concerts"
    ],
    "facebookEventsUrl": "",
    "phone": "",
    "email": "",
    "contactPerson": "",
    "type": "Live Music Venue",
    "amenities": [],
    "scrapeNotes": "Check https://www.akconcerts.com for event calendar."
  },
  {
    "id": "alaska-airlines-center",
    "name": "Alaska Airlines Center",
    "city": "Anchorage",
    "address": "3550 Providence Dr, Anchorage, AK, United States, Alaska",
    "lat": 61.2046,
    "lng": -149.9053,
    "website": "https://thealaskaairlinescenter.com/",
    "facebookUrl": "https://www.facebook.com/AlaskaAirlinesCenter",
    "capacity": null,
    "indoor": true,
    "aliases": [
      "alaska airlines center"
    ],
    "facebookEventsUrl": "https://www.facebook.com/AlaskaAirlinesCenter/events",
    "phone": "(907) 786-7850",
    "email": "alaskaairlinescenter@uaa.alaska.edu",
    "contactPerson": "",
    "type": "Live Music Venue",
    "amenities": [],
    "scrapeNotes": "Check https://www.facebook.com/AlaskaAirlinesCenter/events for upcoming shows."
  },
  {
    "id": "alaska-botanical-garden",
    "name": "Alaska Botanical Garden",
    "city": "Anchorage",
    "address": "Anchorage",
    "lat": 61.22,
    "lng": -149.9035,
    "website": "",
    "facebookUrl": "https://www.facebook.com/alaskabotanicalgarden",
    "capacity": null,
    "indoor": true,
    "aliases": [
      "alaska botanical garden"
    ],
    "facebookEventsUrl": "https://www.facebook.com/alaskabotanicalgarden/events",
    "phone": "",
    "email": "",
    "contactPerson": "",
    "type": "Live Music Venue",
    "amenities": [],
    "scrapeNotes": "Check https://www.facebook.com/alaskabotanicalgarden/events for upcoming shows."
  },
  {
    "id": "alaska-center-for-the-performing-arts",
    "name": "Alaska Center for the Performing Arts",
    "city": "Anchorage",
    "address": "621 W 6th Ave, Anchorage, AK 99501",
    "lat": 61.2167,
    "lng": -149.8925,
    "website": "https://www.alaskapac.org/",
    "facebookUrl": "https://www.facebook.com/ACPAevents",
    "capacity": 2000,
    "indoor": true,
    "aliases": [
      "acpa",
      "alaska pac",
      "performing arts center",
      "atwood concert hall",
      "discovery theatre",
      "sydney laurence theatre",
      "alaska center for the performing arts"
    ],
    "facebookEventsUrl": "https://www.facebook.com/CenterTix/events",
    "phone": "(907) 263-2787",
    "email": "info@centertix.com",
    "contactPerson": "",
    "type": "Live Music Venue",
    "amenities": [],
    "scrapeNotes": "Check https://www.facebook.com/CenterTix/events for upcoming shows."
  },
  {
    "id": "alaska-dance-promotions",
    "name": "Alaska Dance Promotions",
    "city": "Anchorage",
    "address": "Anchorage",
    "lat": 61.2177,
    "lng": -149.9139,
    "website": "",
    "facebookUrl": "https://www.facebook.com/AlaskaDancePromotions",
    "capacity": null,
    "indoor": true,
    "aliases": [
      "alaska dance promotions"
    ],
    "facebookEventsUrl": "https://www.facebook.com/AlaskaDancePromotions/events",
    "phone": "",
    "email": "",
    "contactPerson": "",
    "type": "Live Music Venue",
    "amenities": [],
    "scrapeNotes": "Check https://www.facebook.com/AlaskaDancePromotions/events for upcoming shows."
  },
  {
    "id": "alaska-experience-theater",
    "name": "Alaska Experience Theater",
    "city": "Anchorage",
    "address": "Anchorage",
    "lat": 61.2207,
    "lng": -149.8983,
    "website": "",
    "facebookUrl": "https://www.facebook.com/AKExperiencetheater",
    "capacity": null,
    "indoor": true,
    "aliases": [
      "alaska experience theater"
    ],
    "facebookEventsUrl": "https://www.facebook.com/AKExperiencetheater/events",
    "phone": "",
    "email": "",
    "contactPerson": "",
    "type": "Live Music Venue",
    "amenities": [],
    "scrapeNotes": "Check https://www.facebook.com/AKExperiencetheater/events for upcoming shows."
  },
  {
    "id": "american-legion-jack-henry-post-1",
    "name": "American Legion Jack Henry Post 1",
    "city": "Anchorage",
    "address": "American Legion Jack Henry Post 1, Anchorage, AK",
    "lat": 61.2181,
    "lng": -149.9003,
    "website": "",
    "facebookUrl": "",
    "facebookEventsUrl": "",
    "phone": "",
    "email": "",
    "contactPerson": "",
    "type": "Live Music Venue",
    "capacity": null,
    "indoor": true,
    "aliases": [
      "american legion jack henry post 1"
    ],
    "amenities": [],
    "scrapeNotes": "Search Facebook or web for 'American Legion Jack Henry Post 1' in Anchorage."
  },
  {
    "id": "american-legion-post-28",
    "name": "American Legion Post 28 (Spenard)",
    "city": "Anchorage",
    "address": "7001 Spenard Rd, Anchorage, AK 99502",
    "lat": 61.1594,
    "lng": -149.9608,
    "website": "https://alaskapost28.org/",
    "facebookUrl": "https://www.facebook.com/Post28",
    "capacity": 200,
    "indoor": true,
    "aliases": [
      "american legion spenard post 28",
      "american legion spenard post",
      "spenard legion",
      "american legion post 28",
      "American Legion Spenard Post 28 -",
      "american legion post 28 (spenard)"
    ],
    "facebookEventsUrl": "https://www.facebook.com/Post28/events",
    "phone": "(907) 344-3841",
    "email": "office@akpost28.com",
    "contactPerson": "",
    "type": "Live Music Venue",
    "amenities": [],
    "scrapeNotes": "Check https://www.facebook.com/Post28/events for upcoming shows."
  },
  {
    "id": "amvets-post-2",
    "name": "Amvets Post 2",
    "city": "Anchorage",
    "address": "Anchorage",
    "lat": 61.2179,
    "lng": -149.9115,
    "website": "",
    "facebookUrl": "https://www.facebook.com/AmvetsPost2AK",
    "capacity": null,
    "indoor": true,
    "aliases": [
      "amvets post 2"
    ],
    "facebookEventsUrl": "https://www.facebook.com/AmvetsPost2AK/events",
    "phone": "",
    "email": "",
    "contactPerson": "",
    "type": "Live Music Venue",
    "amenities": [],
    "scrapeNotes": "Check https://www.facebook.com/AmvetsPost2AK/events for upcoming shows."
  },
  {
    "id": "anchorage-loussac-library",
    "name": "Anchorage Loussac Library",
    "city": "Anchorage",
    "address": "Anchorage",
    "lat": 61.2048,
    "lng": -149.8975,
    "website": "http://anchoragelibrary.evanced.info/signup/calendar",
    "facebookUrl": "",
    "capacity": null,
    "indoor": true,
    "aliases": [
      "anchorage loussac library"
    ],
    "facebookEventsUrl": "",
    "phone": "",
    "email": "",
    "contactPerson": "",
    "type": "Live Music Venue",
    "amenities": [],
    "scrapeNotes": "Check http://anchoragelibrary.evanced.info/signup/calendar for event calendar."
  },
  {
    "id": "anchorage-moose-lodge",
    "name": "Anchorage Moose Lodge",
    "city": "Anchorage",
    "address": "4211 Arctic Blvd, Anchorage, AK, United States, Alaska",
    "lat": 61.2139,
    "lng": -149.8975,
    "website": "https://www.anchoragemooselodge.com",
    "facebookUrl": "https://www.facebook.com/Anchoragemooselodge",
    "capacity": null,
    "indoor": true,
    "aliases": [
      "anchorage moose lodge"
    ],
    "facebookEventsUrl": "https://www.facebook.com/Anchoragemooselodge/events",
    "phone": "(907) 563-3502",
    "email": "admin@anchoragemooselodge.com",
    "contactPerson": "",
    "type": "Live Music Venue",
    "amenities": [],
    "scrapeNotes": "Check https://www.facebook.com/Anchoragemooselodge/events for upcoming shows."
  },
  {